{"key_points": ["Meeting tomorrow at 10:00 AM", "Location: 3rd floor conference room", "Prepare product demonstration materials in English", "Bring a computer/PC to the meeting", "A will send materials tonight"], "summary": "Speaker A asks to confirm the start time of tomorrow's meeting. Speaker B confirms it starts at 10 AM in the third-floor conference room. A agrees to prepare product demo materials and B requests they be in English with a PC brought along, which A agrees to send tonight.", "title": "Confirmation for Tomorrow's 10 AM Meeting", "turns": [{"index": 0, "lang": "zh", "translation": "What time does our meeting start tomorrow? I want to confirm the time."}, {"index": 1, "lang": "ja", "translation": "Tomorrow's meeting is from 10 AM. The location is the conference room on the third floor."}, {"index": 2, "lang": "zh", "translation": "Okay, then I will prepare the product demonstration materials. Do I need to bring a computer?"}, {"index": 3, "lang": "ja", "translation": "Yes, please bring your computer. Please prepare the materials in English."}, {"index": 4, "lang": "zh", "translation": "No problem, I will send the materials to you tonight. Thank you."}]}